title,rating,feature
Barbie as the Island Princess,7.241,shipwreck child rosella barbie grow island watchful eye love animal friend arrival prince antonio lead rosella furry pal explore civilization ultimately save kingdom uncover secret plot animation family greg richardson kelly sheridan melissa lyons alessandro juliani christopher gaze
Beauty and the Beast: The Enchanted Christmas,6.216,astonish find beast deepseeded hatred christmas season belle endeavor change mind matter animation family fantasy andrew knight paige o'hara robby benson jerry orbach david ogden stiers
Fast Times at Ridgemont High,6.803,base reallife adventure chronicle cameron crowe fast time follow group high school student grow southern california stacy hamilton mark ratner look love interest help along old classmate linda barrett mike damone respectively center film jeff spicoli perpetually stone surfer facesoff resolute mr hand—a man convince everyone dope comedy amy heckerling sean penn jennifer jason leigh judge reinhold robert romanus
Shrek the Halls,6.357,christmas tree thing green new holiday classic shrek back try get spirit season promise fiona kid christmas remember force take crash course holiday think everything quiet family christmas right knock door adventure animation comedy fantasy family gary trousdale mike myers eddie murphy cameron diaz antonio banderas
The Adventures of Ichabod and Mr. Toad,6.4,wind willow concise version kenneth grahame story name j thaddeus toad owner toad hall prone fad newfangled motor car desire late land much trouble wrong crowd friend mole rat badger save legend sleepy hollow retelling washington irving story set tiny new england town ichabod crane new schoolmaster fall town beauty katrina van tassel town bully brom bone decide little successful need convince katrina horror fantasy animation family clyde geronimi bing crosby basil rathbone eric blore j. pat o'malley
The Scorpion King 2: Rise of a Warrior,4.715,heroic tale young mathayus relentless quest justice evil powerful villain king sargon mathayus face heartstopping tribulation adventurous oddsdefying trajectory toward ultimate destiny become formidable warrior king ancient desert empire action adventure fantasy science fiction russell mulcahy michael copon randy couture karen david simon quarterman
Mirrors,6.281,excop family target evil force use mirror gateway home horror mystery alexandre aja kiefer sutherland paula patton amy smart jason flemyng
Sex Drive,6.365,high school senior drive crosscountry best friend hook babe meet online comedy adventure romance sean anders josh zuckerman amanda crew clark duke james marsden
Labyrinth,7.278,teen sarah force babysit halfbrother toby summon jareth goblin king take away actually kidnap sarah give thirteen hour solve labyrinth rescue adventure family fantasy jim henson david bowie jennifer connelly toby froud shelley thompson
High School Musical 2,6.524,east high wildcat gear big fun land cool summer job imaginable troy gabriella chad taylor score sweet gig lava spring country club sharpay ryan family sharpay first rule business get troy troy experience life privilege never know give wildcat gabriella rise top comedy drama family music romance tv movie kenny ortega zac efron vanessa hudgens ashley tisdale lucas grabeel
101 Dalmatians II: Patch's London Adventure,6.034,one 101 take toll patch feel unique accidentally leave behind move day meet idol thunderbolt enlist publicity campaign family animation adventure comedy brian smith barry bostwick jason alexander martin short bobby lockwood
Arthur,6.494,arthur 30yearold child inherit 750 million comply family demand marry woman choosing comedy drama romance steve gordon dudley moore liza minnelli john gielgud geraldine fitzgerald
Christmas with the Kranks,6.145,daughter blair leave family nest luther nora krank decide book island cruise beat yuletide blue skip holiday decision boycott tradition whole neighborhood uproar blair call christmas eve announce surprise visit new fiancée kranks twelve hour perform miracle pull neighbor together throw best celebration ever comedy family joe roth tim allen jamie lee curtis dan aykroyd m. emmet walsh
The Game Plan,6.487,bachelor football star joe kingman seem wealthy carefree team way capture championship suddenly tackle unexpected news young daughter result last fling exwife joe must learn balance personal professional life need child comedy family andy fickman dwayne johnson madison pettis kyra sedgwick roselyn sánchez
Open Season 2,5.8,fall head hoof love giselle elliot road altar take slight detour mr weenie kidnap group pampered pet determine return owner adventure animation comedy family matthew o'callaghan joel mchale mike epps cody cameron georgia engel
Home on the Range,6.1,greedy outlaw scheme take possession patch heaven dairy farm three determine cow karatekicking stallion colorful corral critter join force save home stake skyhigh unlikely animal alliance risk hide match wit mysterious band bad guy animation family will finn roseanne barr judi dench jennifer tilly steve buscemi
A Dirty Shame,5.3,sylvia stickles run convenience store husband motherinlaw one day sylvia hit head transforms uptight prude sexcrazed lunatic go rampage town sylvia attract attention ray ray sexual healer tow truck driver search world great orgasm sexual revolution however cause class war tiny baltimore community comedy fantasy john waters tracey ullman johnny knoxville selma blair chris isaak
The Santa Clause 3: The Escape Clause,5.509,santa mrs claus north pole running smoothly counsel legendary figure call emergency meeting christmas eve evil jack frost make trouble look take holiday launch plan sabotage toy factory compel scott invoke littleknown escape clause wish would never become santa comedy family adventure michael lembeck tim allen elizabeth mitchell eric lloyd judge reinhold
The Unborn,5.186,young woman fight spirit slowly take possession horror thriller mystery david s. goyer odette annable cam gigandet gary oldman idris elba
Race to Witch Mountain,5.817,taxi driver get bargain pick two teen runaway pair possess supernatural power also try desperately escape people make target adventure family fantasy science fiction thriller action andy fickman dwayne johnson annasophia robb alexander ludwig carla gugino
Sweeney Todd: The Demon Barber of Fleet Street,7.182,infamous story benjamin barker aka sweeney todd set barber shop london basis sinister partnership fellow tenant mrs lovett base hit broadway musical drama horror tim burton johnny depp helena bonham carter alan rickman timothy spall
Return to the Blue Lagoon,6.2,sequel 1980 classic two child strand beautiful island south pacific adult guide two make simple life together eventually become tanned teenager love adventure drama william a. graham milla jovovich brian krause lisa pelikan courtney barilla
Death Wish,6.9,wife murder street punk pacifistic new york city architect become oneman vigilante squad prowl street wouldbe mugger dark crime drama action michael winner charles bronson hope lange vincent gardenia steven keats
Closing the Ring,6.1,1940s group young men go war leave behind ethel ann love one teddy modernday belfast man name jimmy endeavor return ring find wreckage crashed plane travel michigan grown ethel ann marry another man teddy kill battle live ethel ann must decide whether go jimmy meet soldier last saw teddy alive drama romance richard attenborough shirley maclaine christopher plummer mischa barton stephen amell
Wild Child,6.7,sixteenyearold poppy everything unlimited credit card buy spoiled attitude match final thoughtless prank exasperate father ship board school england poppy meet match stern headmistress class full girl tolerate selfishness comedy drama romance nick moore emma roberts alex pettyfer natasha richardson kimberley nixon
Dead Silence,6.432,jamie return hometown search answer wife murder occur receive weird package contain ventriloquist dummy name billy may link legend ventriloquist mary shaw destine find truth jamie go town raven fair shaw use perform bury jamie expect horror james wan ryan kwanten amber valletta donnie wahlberg bob gunton
Meatballs,5.8,tripper head counselor budget summer camp call camp northstar truth young heart marginally mature camper tripper befriend rudy loner camper trouble fit tripper inspire young charge defeat rival camp mohawk annual olympiad competition rudy play matchmaker tripper roxanne female counselor northstar comedy ivan reitman bill murray harvey atkin russ banham kristine debell
You Got Served,6.349,mr rad warehouse best hiphop crew los angeles compete money respect suburban crew crash party steal dancer move two war friend pull together represent street star hiphop sensation marque houston omari grandberry lil kim comedian steve harvey music drama chris stokes marques houston omarion j-boog lil' fizz
Cinderella II: Dreams Come True,6.109,newly crown princess cinderella quickly learn life palace royal responsibility challenging imagine three heartwarming tale cinderella call animal friend fairy godmother help bring grace charm regal role discovers true best way make dream come true family animation romance fantasy john kafka jennifer hale rob paulsen corey burton andre stojka
Lie with Me,5.17,happily unattached sexually voracious leila satisfy desire host rapidly change bed partner unconcerned emotional consequence change meet artist look deep commitment drama clement virgo lauren lee smith eric balfour polly shannon mayko nguyen
My Sassy Girl,6.661,guy life plan wooed groom dump elusive woman comedy romance yann samuell elisha cuthbert jesse bradford austin basis chris sarandon
The Adventures of Sharkboy and Lavagirl,5.175,everyone always know max wild imagination one believe wild creation boy raise watchful great white shark girl force volcano real two pintsized action master show max even ordinary kid take extraordinary adventure family science fiction robert rodriguez taylor lautner taylor dooley cayden boyd david arquette
Prey,5.858,american family holiday africa become lose game reserve stalk vicious killer lion adventure horror thriller darrell james roodt bridget moynahan peter weller carly schroeder jamie bartlett
The Uninvited,6.467,anna return home spending time psychiatric facility follow mother tragic death discovers mother former nurse rachel move house become engaged father soon learn shock news anna visit mother ghost warn rachel evil intention horror charles guard emily browning arielle kebbel david strathairn elizabeth banks
Somers Town,6.795,two teenager newcomer london forge unlikely friendship course hot summer tomo thomas turgoose runaway nottingham marek piotr jagiello live district somers town king cross euston station dad work new rail link comedy drama shane meadows thomas turgoose piotr jagiello elisa lasowski kate dickie
Virgin Territory,4.782,black death era tuscany decameron ten young florentine take refuge plague instead tell story lusty adventure bawdy exchange romance swordplay randy nun saracen pirate sexy cow adventure action comedy romance david leland hayden christensen mischa barton kate groombridge rosalind halstead
Blame It on Rio,5.7,matthew hollis man holiday rio best friend men teenage daughter matthew fall best friend amorous daughter name jennifer embark secret slightly onesided relationship jennifer father furious find older man daughter life set hunt aid matthew comedy romance stanley donen michael caine michelle johnson joseph bologna demi moore
Adventures in Babysitting,6.9,plan boyfriend fall high school senior chris parker end babysitting anderson kid brad sara quiet night however turn series ridiculous exploit start leave house pick chris friend brenda soon brad buddy daryl involve group must contend car thief blue musician much comedy chris columbus elisabeth shue maia brewton keith coogan anthony rapp
Death Wish II,6.26,paul kersey vigilante try find five punk murder housekeeper daughter los angeles action crime drama michael winner charles bronson jill ireland vincent gardenia j.d. cannon
Beverly Hills Chihuahua,5.368,pampered beverly hill chihuahua name chloe vacation mexico owner viv niece rachel get lose must rely friend help get back home catch dognapper want ransom comedy family adventure romance raja gosnell drew barrymore piper perabo andy garcía george lopez
Sinbad: Legend of the Seven Seas,6.975,sailor legend frame goddess eris theft book peace must travel realm end world retrieve save life childhood friend prince proteus family animation adventure comedy fantasy action tim johnson brad pitt catherine zeta-jones michelle pfeiffer joseph fiennes
Body Heat,7.0,midst searing florida heat wave woman convince lover smalltown lawyer murder rich husband crime romance lawrence kasdan william hurt kathleen turner richard crenna ted danson
Sex and Death 101,6.145,guy life turn around email include name everyone sex ever sex situation get bad encounter femme fatale ryder target men guilty sex crime comedy romance drama daniel waters simon baker winona ryder julie bowen leslie bibb
Fireproof,7.641,heroic fire captain value dedication service others else important partnership life marriage go smoke drama romance alex kendrick kirk cameron erin bethea ken bevel stephen dervan
The Rugrats Movie,6.162,base popular nickelodeon tv series rugrats first fulllength feature animate movie star little tot story diaperclad kid tell baby point ofview one hottestselling toy franchise late 90s family animation comedy adventure igor kovalyov whoopi goldberg david spade elizabeth daily tara strong
The Butterfly Effect 2,4.943,girlfriend julie two best friend kill tragic auto accident nick struggle cope loss grief suffer migrainelike seizure nick soon discovers power change past via memory however timetraveling attempt alter past save one true love unexpected dire consequence drama science fiction thriller john r. leonetti eric lively erica durance dustin milligan gina holden
The Ultimate Gift,7.616,wealthy grandfather finally die jason stevens fully expect benefit come reading instead sizable inheritance jason receive test series task must complete get money romance drama family michael o. sajbel drew fuller abigail breslin james garner bill cobbs
The Librarian: The Curse of the Judas Chalice,6.3,dangerous mission recover historic juda chalice flynn save simone doublecrossed respect professor ambush ruthless gang flynn realize simone secret true mission shocking discovery lie within decay new orleans crypt fantasy adventure comedy jonathan frakes noah wyle stana katic jane curtin bob newhart
Night Shift,6.013,nebbish morgue attendant get shunt back night shift shackle obnoxious neophyte partner dream one great idea success life take bizarre turn prostitute neighbor complain loss pimp partner upon hear situation suggest fill open use morgue night comedy ron howard henry winkler michael keaton shelley long gina hecht
Mickey's Christmas Carol,7.627,ebenezer scrooge far greedy understand christmas time kindness generosity guidance new found friend scrooge learns embrace spirit season retelling classic dickens tale disney classic character family animation burny mattinson alan young wayne allwine clarence nash hal smith
The Hot Spot,6.3,upon arrive small town drifter quickly get trouble local authority — local woman — rob bank romance crime thriller dennis hopper don johnson virginia madsen jennifer connelly charles martin smith
G.I. Joe: The Rise of Cobra,5.8,egyptian desert deep polar ice cap elite gi joe team use late nextgeneration spy military equipment fight corrupt arm dealer destro grow threat mysterious cobra organization prevent plunge world chaos adventure action thriller science fiction stephen sommers adewale akinnuoye-agbaje christopher eccleston lee byung-hun joseph gordon-levitt
The Jungle Book 2,5.9,mowgli live manvillage little stepbrother ranjan best friend shanti mancub still jungle rhythm heart miss old buddy baloo bagheera mowgli wanders back wild swingin fun soon find maneating tiger shere khan lurk shadow plan revenge family animation adventure steve trenbirth john goodman haley joel osment mae whitman connor funk
Pooh's Grand Adventure: The Search for Christopher Robin,7.2,pooh get confuse christopher robin leave note say go back school holiday pooh piglet tigger eeyore rabbit go search christopher robin lead big adventure animation family adventure karl geurs jim cummings john fiedler ken sansom paul winchell
Uptown Girls,6.811,molly gunn freewheel daughter deceased rock legend force get job manager steal money nanny precocious ray oft ignored daughter music executive learn mean adult teach ray child comedy drama boaz yakin brittany murphy dakota fanning marley shelton donald faison
Thick as Thieves,5.965,master thief recruit notorious thief help steal two famous faberge egg impenetrable vault effort pull one final job repay debt russian mob action thriller crime mimi leder morgan freeman antonio banderas radha mitchell robert forster
Undisputed,6.5,monroe hutchens heavyweight champion sweetwater maximum security prison convict life sentence due passionate crime iceman chamber heavyweight champion lose title due rape conviction ten year sweetwater two giant collide prison fight disputing real champion drama crime walter hill wesley snipes ving rhames peter falk michael rooker
Crank: High Voltage,6.07,chelios face chinese mobster steal nearly indestructible heart replace batterypowered ticker require regular jolt electricity keep working action thriller crime mark neveldine jason statham amy smart david carradine dwight yoakam
Another Cinderella Story,6.83,guy dance could girl dream costume ball one hint identity zune leave behind rush home order make curfew onceinalifetime opportunity front set find masked beauty comedy music damon santostefano selena gomez drew seeley jane lynch katharine isabelle
Barbie as The Princess & the Pauper,7.459,first animated musical feature seven original song barbie come life modern retelling classic tale mistaken identity power friendship base story mark twain animation family comedy william lau kelly sheridan melissa lyons julie stevens mark hildreth
Barbie in the Nutcracker,6.855,barbie star clara animated retelling classic christmas ballet complete tchaikovsky soundtrack ballet choreography animation family owen hurley kelly sheridan kirby morrow tim curry peter kelamis
Undisputed II: Last Man Standing,7.3,heavyweight champ george iceman chamber send russian jail trumpedup drug charge order win freedom must fight jailhouse fight champ uri boyka battle death time fight title fight life action crime thriller isaac florentine michael jai white scott adkins ben cross eli danker
Twilight Zone: The Movie,6.5,anthology film present remake three episode twilight zone tv series— kick good life nightmare 20000 foot —and one original story time horror fantasy science fiction steven spielberg dan aykroyd albert brooks scatman crothers john lithgow
Every Which Way but Loose,6.128,philo beddoe regular easygoing truckdriving guy also best barroom brawler west rockies live 165pound orangutan name clyde like guy philo finally fall love flighty singer lead screwball chase across american southwest nothing way except motorcycle gang cop legendary brawler tank murdock action comedy adventure romance drama james fargo clint eastwood sondra locke geoffrey lewis manis
Tyler Perry's The Family That Preys,6.8,wealthy socialite charlotte cartwright dear friend alice pratt work class woman high ideal enjoy lasting friendship throughout several decade recently life become mire turmoil adult child ’ extramarital affair unethical business practice dark secret threaten derail family fortune unravel life involve charlotte alice decide take breather make crosscountry road trip rediscover possibly find way save family ruin drama romance tyler perry alfre woodard sanaa lathan rockmond dunbar kadee strickland
The Greatest Game Ever Played,7.3,biopic 20yearold francis ouimet defeat golfing idol 1900 u open champion harry vardon drama bill paxton shia labeouf stephen dillane josh flitter peter firth
The Last House on the Left,5.98,eve 17th birthday mari friend phyllis set family home attend rock concert city attempt score drug way pair run afoul group vicious crook head sadistic krug horror thriller wes craven sandra peabody lucy grantham david hess fred j. lincoln
Stitch! The Movie,6.452,continue adventure lilo little hawaiian girl stitch galaxy mostwanted extraterrestrial stitch pleakley dr jumba part household lilo stitch know dr jumba bring alien experiment hawaiʻi well comedy adventure family animation bobs gannaway daveigh chase chris sanders tia carrere david ogden stiers
The Prince & Me 2: The Royal Wedding,5.815,week royal wedding paige edvard find relationship danish monarchy jeopardy old law bring light state unmarried heir throne may marry woman noble blood else must relinquish crown romance comedy family catherine cyran luke mably kam heskin maryam d'abo clemency burton-hill
Scooby-Doo! and the Cyber Chase,7.303,scooby gang get trap video game create gang must fight phantom virus escape game must go level level defeat game animation adventure comedy jim stenstrum scott innes frank welker grey delisle b.j. ward
Fire in the Sky,6.591,group men clear brush government arrive back town claim friend abduct alien nobody believe despite lack motive evidence foul play friend disappearance treat murder science fiction drama mystery rob lieberman d.b. sweeney robert patrick craig sheffer peter berg
An Extremely Goofy Movie,6.402,extreme sport life freedom max set college goofy miss max much lose job go finish college alongside max friend goofy try get close max must go extreme learn live live together animation family comedy douglas mccarthy bill farmer jason marsden jeff bennett jim cummings
Sophie's Choice,7.331,stingo young writer move brooklyn 1947 begin work first novel become friendly sophie lover nathan learn holocaust survivor flashback reveal harrowing story prewar prosperity auschwitz present sophie nathan relationship increasingly unravels stingo grow close sophie nathan fragile mental state become ever apparent drama romance war alan j. pakula meryl streep kevin kline peter macnicol rita karin
If Only,6.995,impetuous musician girlfriend samantha die accident shortly fight nearly break griefstricken british businessman ian wyndham live london get chance relive day hope change event lead get kill fantasy drama romance gil junger jennifer love hewitt paul nicholls tom wilkinson diana hardcastle
A Goofy Movie,6.985,endear modernday story lovable goof bond teenage son max hilarious crosscountry road trip en route old fishing hole find floppy ear misadventure romance animation family comedy adventure kevin lima bill farmer jason marsden rob paulsen jim cummings
Barbie and the Magic of Pegasus,7.179,princess annika escape clutch evil wizard explore wonder cloud kingdom team magnificent wing horse turn sister princess brietta defeat wizard break spell imprison family animation family romance greg richardson kelly sheridan kathleen barr lalainia lindbjerg colin murdock
The Return of Jafar,6.247,evil jafar escape magic lamp allpowerful genie ready plot revenge aladdin battle elusive villain atop winged horse dodge flame inside explode lava pit aladdin princess jasmine outrageously funny genie side save kingdom family adventure animation romance toby shelton scott weinger linda larkin jonathan freeman gilbert gottfried
Invasion U.S.A.,5.754,oneman army come rescue united state spy attempt invasion action joseph zito chuck norris richard lynch melissa prophet alexander zale
The Loneliness of the Long Distance Runner,7.2,rebellious youth sentence reformatory rob bakery rise rank institution prowess long distance runner solitary run revery life time incarceration lead reevaluate privileged status prized athlete drama tony richardson michael redgrave tom courtenay avis bunnage alec mccowen
The Delta Force,5.9,707 aircraft jetliner en route athens rome new york city hijack lebanese terrorist demand pilot take beirut terrorist realize elite team commando call eliminate terrorist jetliner action thriller adventure war menahem golan chuck norris lee marvin shelley winters martin balsam
Cinderella III: A Twist in Time,6.534,lady tremaine steal fairy godmother wand change history cinderella restore timeline reclaim prince animation romance family fantasy frank nissen jennifer hale christopher daniel barnes susanne blakeslee tress macneille
Juice,7.215,four harlem friend bishop q steel raheem dabble petty crime decide go big knock convenience store bishop magnetic leader group gun q different aspiration want dj happen gig night robbery unfortunately bishop willing take answer game everything keep crime drama thriller ernest r. dickerson omar epps tupac shakur khalil kain jermaine hopkins
Buzz Lightyear of Star Command: The Adventure Begins,6.39,buzz lightyear must battle emperor zurg help three hopeful insist partner animation family comedy science fiction adventure tad stones tim allen nicole sullivan stephen furst larry miller
Batman Beyond: Return of the Joker,7.3,joker back vengeance neogotham dark knight terry mcginnis need answer stand alone face old gotham infamous clown prince crime animation family action science fiction curt geda will friedle kevin conroy mark hamill angie harmon
