title,rating,feature
Girl in the Box,6.7,hitchhike woman abduct young couple hold captive seven year time torture force live slave captor drama stephen kemp addison timlin zane holtz zelda williams matt cooke
The Son of Bigfoot,6.529,teenage outsider adam set epic dare quest uncover mystery behind longlost dad find none legendary bigfoot hide deep forest year protect family hairco giant corporation eager run scientific experiment special dna father son start make lose time boy initial disbelief adam soon discovers gift superpower beyond imagination little know hairco tail adam trace lead bigfoot family animation comedy jérémie degruson pappy faulkner christopher lee parson terrence stone marieve herington
Kill Bill: The Whole Bloody Affair,8.0,assassin shot almost kill ruthless employer bill member assassination circle – live plot vengeance kill bill whole bloody affair complete edit twopart martial art action film kill bill vol 1 kill bill vol 2 film originally schedule release one part however due film 4 hour run time split two part action crime thriller quentin tarantino uma thurman lucy liu vivica a. fox michael madsen
The Batman,7.673,second year fight crime batman uncovers corruption gotham city connect family face serial killer know riddler crime mystery thriller matt reeves robert pattinson zoë kravitz jeffrey wright colin farrell
American Assassin,6.402,follow murder fiancée mitch rapp train instruction cold war veteran stan hurley pair enlist investigate wave apparently random attack military civilian target action adventure thriller michael cuesta dylan o'brien michael keaton taylor kitsch shiva negar
Scary Stories to Tell in the Dark,6.5,mill valley pennsylvania halloween night 1968 play joke school bully stella friend decide sneak supposedly haunt house belong powerful bellow family unleash dark force unable control horror thriller andré øvredal zoe colletti dean norris michael garza gabriel rush
Puss in Boots,6.568,long even meet shrek notorious fighter lover outlaw pus boot become hero set adventure tough street smart kitty softpaws mastermind humpty dumpty save town true story cat myth legend boot animation family fantasy adventure comedy chris miller antonio banderas salma hayek pinault zach galifianakis billy bob thornton
Maleficent: Mistress of Evil,7.308,maleficent goddaughter aurora begin question complex family tie bind pull different direction impend nuptials unexpected ally dark new force play family fantasy adventure action joachim rønning angelina jolie elle fanning harris dickinson michelle pfeiffer
The Conjuring: The Devil Made Me Do It,7.439,paranormal investigator ed lorraine warren encounter would become one sensational case file fight soul young boy take beyond anything would ever see mark first time yous history murder suspect would claim demonic possession defense horror mystery thriller michael chaves patrick wilson vera farmiga ruairí o'connor sarah catherine hook
Sorry to Bother You,6.815,alternate presentday version oakland black telemarketer cassius green discover magical key professional success – propel macabre universe fantasy science fiction comedy boots riley lakeith stanfield tessa thompson jermaine fowler omari hardwick
Ghostbusters: Afterlife,7.386,single mom callie two kid trevor phoebe arrive small oklahoma town begin discover connection original ghostbusters secret legacy grandfather leave behind fantasy comedy adventure science fiction jason reitman mckenna grace finn wolfhard carrie coon bokeem woodbine
X-Rated 2: The Greatest Adult Stars of All-Time,6.8,documentary sequel offer closeup look personal life legendary porn star survive test time influence popular culture blend rare interview erotic clip additional appearance whoopi goldberg steven soderbergh host adult star director trendsetters documentary eli cross mr. skin alana cruise nadia jay leigh raven
Mortal Engines,6.21,many thousand year future earth ’ city roam globe huge wheel devour struggle ever diminish resource one massive traction city old london tom natsworthy unexpected encounter mysterious young woman wasteland change course life forever adventure science fiction christian rivers hera hilmar robert sheehan hugo weaving jihae
Extinction,6.326,chief mechanic factory haunt apocalyptic nightmare become hero earth invade mysterious army bent destruction action drama science fiction thriller ben young michael peña lizzy caplan israel broussard mike colter
The Ritual,6.241,group college friend reunite trip forest encounter menacing presence wood stalk horror thriller mystery david bruckner rafe spall arsher ali robert james-collier sam troughton
The Possession of Hannah Grace,5.594,cop rehab take graveyard shift city hospital morgue face series bizarre violent event cause evil entity one corps horror drama diederik van rooijen shay mitchell kirby johnson grey damon stana katic
Toc Toc,7.105,toc toc follow adventure misadventure group patient ocd date time comedy vicente villanueva alexandra jiménez paco león rossy de palma oscar martínez
The First Omen,6.88,young american woman send rome begin life service church encounter darkness cause question faith uncovers terrify conspiracy hop bring birth evil incarnate horror arkasha stevenson nell tiger free ralph ineson sônia braga bill nighy
Minions: The Rise of Gru,7.3,fanboy supervillain supergroup know vicious 6 gru hatch plan become evil enough join backup follower minion animation comedy family adventure kyle balda steve carell pierre coffin alan arkin taraji p. henson
Cold Pursuit,5.82,quiet family life nels coxman snowplow driver upended son murder nels begin vengeful hunt viking drug lord hold responsible killing eliminate viking associate one one nels draw close viking action bring even unexpected violent consequence prove revenge execution action crime thriller comedy hans petter moland liam neeson tom bateman tom jackson laura dern
Cars Toon Mater's Tall Tales,6.768,mater tow truck travel country country retell infamous unbelievable story animation comedy family john lasseter john cygan lori alan larry the cable guy keith ferguson
The Nun,5.894,priest haunt past novice threshold final vow send vatican investigate death young nun romania confront malevolent force form demonic nun horror corin hardy taissa farmiga demián bichir bonnie aarons jonas bloquet
Happy Death Day,6.643,caught bizarre terrifying time warp college student tree find repeatedly relive day murder ultimately realize must identify killer reason death chance survival run comedy horror mystery christopher landon jessica rothe israel broussard ruby modine rachel matthews
After Porn Ends 2,5.4,porn end 2 pick predecessor leave turn back clock meet old living star adult film history go depth current retiree juxtaposes experience life porn delve deeper society ongoing stigma race misogyny reality decrease opportunity former vhs box cover star career adult entertainment accept proudly without regret fact seem prove pathway current happiness inner peace others however career porn prove conduit certain despair struggle find way bury past emerge new career call documentary bryce wagoner ginger lynn allen lisa ann janine lindemulder chasey lain
The Upside,7.146,phillip wealthy quadriplegic need caretaker help daytoday routine new york penthouse decide hire dell struggle parolee try reconnect ex young son despite come two different world unlikely friendship start blossom comedy drama neil burger kevin hart bryan cranston nicole kidman golshifteh farahani
From Straight A's to XXX,5.881,change circumstance leaf miriam unable pay college tuition make surprising decision start perform adult film use pseudonym belle knox miriam lie family friend school keep double life secret soon rumour spread miriam become subject vicious online attack unwanted attention miriam fight back talk medium say new line work empowers feminist confident stand unintended consequence miriam shun conservative family colleague adult film world one impulsive decision quickly spiral control miriam problem begin drama tv movie vanessa parise haley pullos sasha clements judd nelson alyson bath
Night Hunter,6.584,minnesota police officer cross path committed tireless vigilante follow trail ruthless predator responsible several abduction murder drama thriller david raymond henry cavill ben kingsley alexandra daddario stanley tucci
Goosebumps 2: Haunted Halloween,6.13,careful wish school junk business best friend sonny sam hope find treasure people ’ trash clean old stine house open locked book free supernatural nightmare – slappy help sonny ’ sister sarah race time get sinister dummy creature bring life back page unleash total pandemonium comedy fantasy horror ari sandel jeremy ray taylor madison iseman caleel harris wendi mclendon-covey
The First Purge,5.999,push crime rate one percent rest year new found father america test sociological theory vent aggression one night one isolated community violence oppressor meet rage others contagion explode trialcity border spread across nation horror action thriller gerard mcmurray y'lan noel lex scott davis joivan wade steve harris
Midnight Temptations,4.6,april fashion designer design contest determine win main competitor childhood acquaintance danny whatever take win contest include sleep influential people major clothing company bos find dead april prime suspect must find way clear name find real killer thriller ralph e. portillo wendy hamilton casey mitchell justin lauer anthony flacco
Game Night,6.852,max annie weekly game night get kick notch max brother brook arrange murder mystery party complete fake thug federal agent brooks get kidnap suppose part game competitor set solve case start learn neither game brook seem friend soon find head twist lead another unexpected turn course one chaotic night mystery comedy crime john francis daley jason bateman rachel mcadams kyle chandler sharon horgan
Fighting with My Family,6.862,bear tightknit wrestling family paige brother zak ecstatic get onceinalifetime opportunity try wwe paige earn spot competitive training program must leave loved one behind face new cutthroat world alone paige journey push dig deep ultimately prove world make different thing make star comedy stephen merchant florence pugh lena headey nick frost vince vaughn
Bad Times at the El Royale,6.8,lake tahoe 1969 seven stranger one secret bury meet el royale decadent motel dark past course fateful night everyone one last shot redemption thriller mystery crime drew goddard jeff bridges cynthia erivo lewis pullman dakota johnson
The Post,7.0,coverup span four yous president push country first female newspaper publisher harddriving editor join unprecedented battle journalist government inspire true event drama history steven spielberg meryl streep tom hanks sarah paulson bob odenkirk
The Girl in the Spider's Web,6.142,enlist recover dangerous computer program hacker lisbeth salander journalist mikael blomkvist find catch web spy cybercriminals corrupt government official action crime thriller fede álvarez claire foy sverrir gudnason lakeith stanfield sylvia hoeks
Trolls World Tour,7.3,queen poppy branch make surprising discovery — troll world beyond distinct difference create big clash various tribe mysterious threat put troll across land danger poppy branch band friend must embark epic quest create harmony among feud troll unite certain doom family animation comedy fantasy adventure music walt dohrn anna kendrick justin timberlake ron funches rachel bloom
Skyscraper,6.317,frame run former fbi agent must save family blazing fire world tall building action thriller adventure rawson marshall thurber dwayne johnson neve campbell chin han roland møller
Life in a Year,8.26,17 year old find girlfriend die set give entire life last year leave drama romance mitja okorn jaden smith cara delevingne cuba gooding jr. chris d'elia
Guardians of the Galaxy Vol. 3,7.969,peter quill still reel loss gamora must rally team around defend universe along protect one mission complete successfully could quite possibly lead end guardian know science fiction adventure action james gunn chris pratt zoe saldaña dave bautista karen gillan
X-Men: The Mutant Watch,6.998,senator kelly address senate committee suppose mutant menace learn making movie xmen documentary thomas c. grane bruce davison terry anzur bryan singer hugh jackman
Den of Thieves,6.806,gritty crime saga follow life elite unit la county sheriff dept state successful bank robbery crew outlaw plan seemingly impossible heist federal reserve bank action crime thriller christian gudegast gerard butler dawn olivieri o'shea jackson jr. pablo schreiber
The Hustle,6.193,two female scam artist one low rent high class compete swindle naïve tech prodigy fortune remake 1988 comedy dirty rotten scoundrel comedy crime chris addison anne hathaway rebel wilson alex sharp ingrid oliver
Infidelity in Suburbia,6.313,husband away work son school laura dream homerenovation project supplant restless day elliott irresistibly hot private contractor soon fulfill forbidden dream thriller tv movie david winning marcus rosner sarah butler miranda frigon peter benson
Cinderella's Hot Night,5.724,cinderella hot night present lively retelling classic fairy tale slightly mature erotic twist follow adventure bewildered cindy fall prey wicked sexcrazed benefactor pin secret love noble european prince help smoking hot fairy godmother cindy finally realize dream become reallife princess fantasy comedy dean mckendrick karlie montana christine nguyen beverly lynne sarah hunter
Doctor Strange in the Multiverse of Madness,7.288,doctor strange help mystical ally old new traverse mindbending dangerous alternate reality multiverse confront mysterious new adversary fantasy action adventure sam raimi benedict cumberbatch xochitl gomez elizabeth olsen chiwetel ejiofor
Sonic the Hedgehog,7.321,power incredible speed sonic hedgehog embrace new home earth sonic spark attention superuncool evil genius dr robotnik supervillain vs supersonic allout race across globe stop robotnik use sonic ’ unique power world domination action science fiction comedy family jeff fowler ben schwartz james marsden tika sumpter jim carrey
The Angry Birds Movie 2,7.08,red chuck bomb rest feathered friend surprise green pig suggest put aside difference unite fight common threat aggressive bird island cover ice plan use elaborate weapon destroy fowl swine animation action fantasy adventure comedy thurop van orman jason sudeikis josh gad danny mcbride leslie jones
The Kissing Booth,7.201,teenager elle first kiss lead forbidden romance hot boy high school risk relationship best friend romance comedy vince marcello joey king joel courtney jacob elordi molly ringwald
Knights of the Zodiac,6.419,headstrong street orphan seiya search abducted sister unwittingly tap hidden power discover might person alive protect reincarnated goddess send watch humanity let past go embrace destiny become knight zodiac fantasy action adventure tomek bagiński mackenyu madison iseman diego tinoco mark dacascos
Lamborghini: The Man Behind the Legend,6.462,follow launch lamborghini ’ career manufacturer tractor creator military vehicle world war ii designer lamborghini car launch 1963 highend sport car company automobili lamborghini drama history bobby moresco frank grillo romano reggiani gabriel byrne matteo leoni
Alien: Covenant - Prologue: The Crossing,6.369,aboard hijacked engineer vessel dr shaw repair david make way homeworld engineer shaw believe humanity ’ creator cross official prologue short alien covenant reveal happen crew member dr elizabeth shaw synthetic david event prometheus horror science fiction ridley scott michael fassbender noomi rapace
"Extremely Wicked, Shockingly Evil and Vile",7.012,chronicle crime ted bundy perspective longtime girlfriend elizabeth kloepfer refuse believe truth year drama crime joe berlinger zac efron lily collins kaya scodelario john malkovich
Mamma Mia! Here We Go Again,7.108,five year meet three father sophie sheridan prepares open mother ’ hotel 1979 young donna sheridan meet men could sophie ’ biological father comedy romance ol parker lily james amanda seyfried meryl streep cher
The Boss Baby: Family Business,7.375,templeton brother — tim bos baby little bro ted — become adult drift away new bos baby cuttingedge approach cando attitude bring together … inspire new family business animation comedy adventure family tom mcgrath alec baldwin james marsden amy sedaris ariana greenblatt
Truth or Dare,5.95,harmless game truth dare among friend turn deadly someone—or something—begins punish tell lie—or refuse dare thriller horror jeff wadlow lucy hale violett beane tyler posey hayden szeto
Resident Evil: Welcome to Raccoon City,5.97,booming home pharmaceutical giant umbrella corporation raccoon city die midwestern town company ’ exodus leave city wasteland…with great evil brewing surface evil unleashed townspeople forever…changed…and small group survivor must work together uncover truth behind umbrella make night horror science fiction action johannes roberts kaya scodelario hannah john-kamen robbie amell tom hopper
Security,6.304,exspecial service veteran luck desperate work take job security guard rundown mall rough area town first night job open door distraught desperate young girl flee hijacking police motorcade transport testify witness trial hot heel psychopathic hijacker team henchman stop nothing extract eliminate witness action thriller crime alain desrochers antonio banderas ben kingsley liam mcintyre chad lindberg
Woody Woodpecker,6.586,woody woodpecker enter turf war big city lawyer want tear home effort build house flip comedy family animation alex zamm eric bauza timothy omundson thaila ayala graham verchere
Johnny English Strikes Again,6.273,disaster strike criminal mastermind reveal identity active undercover agent britain secret service rely one man johnny english currently teach minor prep school johnny spring back action find mysterious hacker mission succeed need skill man yesterday ’ analogue method face tomorrow ’ digital technology action adventure comedy david kerr rowan atkinson olga kurylenko ben miller emma thompson
The Legend of Maula Jatt,8.3,maula jatt fierce prizefighter tortured past seek vengeance arch nemesis noori natt feared warrior land punjab drama fantasy action bilal lashari fawad khan hamza ali abbasi mahira khan humaima malick
Every Day,7.236,16year old rhiannon fall love mysterious spirit name “ ” inhabit different body every day feel unmatched connection rhiannon “ ” work day find know next day bring romance fantasy michael sucsy angourie rice justice smith debby ryan maria bello
To All the Boys I've Loved Before,7.616,lara jean love life go imaginary control secret letter every boy ever fall mysteriously mail comedy romance susan johnson lana condor noah centineo janel parrish anna cathcart
Killers of the Flower Moon,7.453,oil discover 1920s oklahoma osage nation land osage people murder one one—until fbi step unravel mystery crime history drama martin scorsese leonardo dicaprio robert de niro lily gladstone jesse plemons
The Zone of Interest,7.142,commandant auschwitz rudolf höss wife hedwig strive build dream life family house garden next camp drama history jonathan glazer christian friedel sandra hüller johann karthaus luis noah witte
The Hate U Give,8.131,raise povertystricken slum 16yearold girl name starr attend suburban prep school witness police officer shoot unarmed best friend torn two different world try speak truth crime drama george tillman jr. amandla stenberg regina hall russell hornsby k.j. apa
I Can Only Imagine,7.505,10yearold bart millard live mother abusive father arthur texas one day mother drop christian camp meet shannon upon return camp bart find mother leave mover remove belonging angrily confront father deny abusiveness reason leave year later high school bart shannon date bart play football please father injure break ankle end career elective opening music class reluctantly sign music drama jon erwin j. michael finley dennis quaid cloris leachman brody rose
It Chapter Two,6.848,27 year overcome malevolent supernatural entity pennywise former member loser club grow move away derry bring back together devastate phone call horror drama fantasy andy muschietti jessica chastain james mcavoy bill hader isaiah mustafa
Teen Titans Go! To the Movies,7.207,major dc superheroes star film teen titan robin determine remedy situation get role sidekick become movie star thus madcap idea inspirational song heart teen titan head hollywood fulfill dream animation action comedy science fiction aaron horvath greg cipes scott menville khary payton tara strong
Ghostland,7.376,mother two inherits home aunt first night new home confront murderous intruder fight daughter ’ life sixteen year later daughter reunite house thing get strange horror mystery thriller pascal laugier crystal reed mylène farmer anastasia phillips emilia jones
The King's Man,6.755,collection history bad tyrant criminal mastermind gather plot war wipe million one man must race time stop action comedy adventure thriller matthew vaughn ralph fiennes gemma arterton rhys ifans matthew goode
Men in Black: International,5.917,men black always protect earth scum universe new adventure tackle big global threat date mole men black organization comedy science fiction action f. gary gray chris hemsworth tessa thompson rebecca ferguson kumail nanjiani
Shockwave: Countdown to Disaster,5.554,stolen seismic weapon activate yemen hostage freed try vain warn global effect start seismic activity californian fault line daughter ex monitor stop action science fiction adventure thriller nick lyon stacey oristano rib hillis ed amatrudo bruce thomas
Escape Plan: The Extractors,5.383,security expert ray breslin hire rescue kidnapped daughter hong kong tech mogul formidable latvian prison breslin girlfriend also capture team must pull deadly rescue mission confront sadistic foe save hostage time run action crime thriller john herzfeld sylvester stallone dave bautista 50 cent zhang jin
47 Meters Down: Uncaged,5.7,four teenage girl go diving adventure explore submerged mayan city inside rush excitement turn jolt terror discover sunken ruin hunting ground deadly great white shark air supply steadily dwindle friend must navigate underwater labyrinth claustrophobic cave eerie tunnel search way watery hell horror johannes roberts sophie nélisse corinne foxx brianne tju sistine rose stallone
The Curse of La Llorona,5.685,1970s los angeles ignore eerie warning troubled mother suspect child endangerment social worker young kid soon draw frightening supernatural realm horror michael chaves linda cardellini raymond cruz patricia velásquez roman christou
Creed II,7.034,personal obligation training next big fight opponent tie family past adonis creed challenge life drama action steven caple jr. michael b. jordan sylvester stallone tessa thompson wood harris
The Call of the Wild,7.6,buck bighearted dog whose blissful domestic life turn upside suddenly uproot california home transplant exotic wild yukon gold rush 1890s new rookie mail delivery dog sled team—and later leader—buck experience adventure lifetime ultimately find true place world become master adventure family drama chris sanders harrison ford dan stevens colin woodell karen gillan
Ron's Gone Wrong,7.9,world walking talk digitally connect bot become child best friend 11yearold find robot buddy quite work others animation science fiction family comedy sarah smith zach galifianakis jack dylan grazer ed helms olivia colman
Don't Breathe 2,7.073,blind man hide several year isolated cabin take raise young girl orphan devastate house fire quiet life together shatter group criminal kidnap girl force blind man leave safe save thriller horror rodo sayagues stephen lang madelyn grace brendan sexton iii adam young
Coming 2 America,6.417,prince akeem joffer set become king zamunda discover son never know america – street savvy queen native name lavelle honor royal father die wish groom son crown prince akeem semmi set america comedy craig brewer eddie murphy arsenio hall jermaine fowler leslie jones
Redcon-1,5.7,zombie apocalypse spread london prison uk bring knee spread virus temporarily contain without cure matter time break boundary big problem all… zombie combat skill enhance south east england quarantine rest world use fortified border intelligence find scientist responsible outbreak alive well london recovery hope cure squad eight special force soldier send suicide mission city rule undead single task get alive within 72 hour mean necessary emerge unlikely pairing course save humanity everrising odds action horror science fiction chee keong cheung oris erhuero carlos gallardo mark strange joshua dickinson
Red Shoes and the Seven Dwarfs,7.725,prince turn dwarfs seek red shoe lady order break spell although easy animation fantasy drama family comedy romance hong sung-ho chloë grace moretz sam claflin gina gershon jim rash
A Witches' Ball,6.3,every year witching world gather celebrate newly induct witch world beatrix 12 eager become part world pending magical status jeopardize need help furry best friend muggs voice joey fatone solve magical riddle big event beatrix sink soar night witch ball family fantasy science fiction justin g. dyck morgan neundorf joey fatone karen slater loukia ioannou
Instant Family,7.523,pete ellie decide start family stumble world foster care adoption hope take one small child meet three sibling include rebellious 15 year old girl find speed zero three kid overnight comedy drama sean anders mark wahlberg rose byrne allyn rachel isabela merced
