title,rating,feature
Home Alone,7.6,eightyearold troublemaker must protect house pair burglar accidentally left home alone family christmas vacation comedy family chris columbus macaulay culkin joe pesci daniel stern john heard
The Godfather: Part III,7.6,follow michael corleone 60 seek free family crime find suitable successor empire crime drama francis ford coppola al pacino diane keaton andy garcia talia shire
When Harry Met Sally...,7.6,harry sally know year good friend fear sex would ruin friendship comedy drama romance rob reiner billy crystal meg ryan carrie fisher bruno kirby
The Little Mermaid,7.6,mermaid princess make faustian bargain attempt become human win prince love animation family fantasy ron clements john musker jodi benson samuel e. wright rene auberjonois
The Naked Gun: From the Files of Police Squad!,7.6,incompetent police detective frank drebin must foil attempt assassinate queen elizabeth ii comedy crime david zucker leslie nielsen priscilla presley o.j. simpson ricardo montalban
"Planes, Trains & Automobiles",7.6,man must struggle travel home thanksgiving lovable oaf shower curtain ring salesman companion comedy drama john hughes steve martin john candy laila robins michael mckean
Lethal Weapon,7.6,two newly pair cop complete opposite must put aside difference order catch gang drug smuggler action crime thriller richard donner mel gibson danny glover gary busey mitchell ryan
Blood Simple,7.6,owner seedy smalltown texas bar discovers one employee affair wife chaotic chain misunderstanding lie mischief ensues devise plot murder crime drama thriller joel coen ethan coen john getz frances mcdormand dan hedaya
On Golden Pond,7.6,norman curmudgeon estranged relationship daughter chelsea golden pond wife nevertheless agree care billy son chelsea new boyfriend unexpected relationship bloom drama mark rydell katharine hepburn henry fonda jane fonda doug mckeon
Mad Max 2,7.6,postapocalyptic australian wasteland cynical drifter agree help small gasolinerich community escape horde bandit action adventure science fiction george miller mel gibson bruce spence michael preston max phipps
The Warriors,7.6,near future charismatic leader summons street gang new york city bid take kill warrior falsely blame must fight way home every gang hunt action crime thriller walter hill michael beck james remar dorsey wright brian tyler
The Muppet Movie,7.6,kermit newfound friends trek across america find success hollywood frog legs merchant kermit adventure comedy family james frawley jim henson frank oz jerry nelson richard hunt
Escape from Alcatraz,7.6,alcatraz secure prison time believe one ever escape three dare men make possible successful attempt escape one infamous prison world action biography crime don siegel clint eastwood patrick mcgoohan roberts blossom jack thibeau
Watership Down,7.6,hop escape destruction human developer save community colony rabbit lead hazel fiver seek safe place set new warren animation adventure drama martin rosen john hubley john hurt richard briers ralph richardson
Midnight Express,7.6,billy hayes american college student catch smuggle drug turkey throw prison biography crime drama alan parker brad davis irene miracle bo hopkins paolo bonacelli
Close Encounters of the Third Kind,7.6,roy neary electric lineman watch quiet ordinary daily life turn upside close encounter ufo drama science fiction steven spielberg richard dreyfuss françois truffaut teri garr melinda dillon
The Long Goodbye,7.6,private investigator philip marlowe help friend jam get implicate wife murder comedy crime drama robert altman elliott gould nina van pallandt sterling hayden mark rydell
Giù la testa,7.6,lowlife bandit ira explosive expert rebel government become hero mexican revolution drama war western sergio leone rod steiger james coburn romolo valli maria monti
Kelly's Heroes,7.6,group yous soldier sneak across enemy line get hand secret stash nazi treasure adventure comedy war brian g. hutton clint eastwood telly savalas don rickles carroll o'connor
The Jungle Book,7.6,bagheera panther baloo bear difficult time try convince boy leave jungle human civilization animation adventure family wolfgang reitherman phil harris sebastian cabot louis prima bruce reitherman
Blowup,7.6,fashion photographer unknowingly capture death film follow two lover park drama mystery thriller michelangelo antonioni david hemmings vanessa redgrave sarah miles john castle
A Hard Day's Night,7.6,two typical day life beatles boy struggle keep sir paul mccartney mischievous grandfather check prepare live television performance comedy music musical richard lester john lennon paul mccartney george harrison ringo starr
Breakfast at Tiffany's,7.6,young new york socialite becomes interested young man move apartment building past threatens get way comedy drama romance blake edwards audrey hepburn george peppard patricia neal buddy ebsen
Giant,7.6,sprawl epic cover life texas cattle rancher family associate drama western george stevens elizabeth taylor rock hudson james dean carroll baker
From Here to Eternity,7.6,hawaii 1941 private cruelly punish box unit team captain wife secondincommand fall love drama romance war fred zinnemann burt lancaster montgomery clift deborah kerr donna reed
Lifeboat,7.6,several survivor torpedoed merchant ship world war ii find lifeboat one crew member youboat sink ship drama war alfred hitchcock tallulah bankhead john hodiak walter slezak william bendix
The 39 Steps,7.6,man london try help counterespionage agent agent kill man stand accused must go run save stop spy ring try steal top secret information crime mystery thriller alfred hitchcock robert donat madeleine carroll lucie mannheim godfrey tearle
Jarhead,6.665,jarhead film u marine anthony swofford ’ experience gulf war put arduous boot camp swofford unit send persian gulf eager fight force stay back action swofford struggle possibility girlfriend cheat mental state deteriorates desire kill increase drama war sam mendes jake gyllenhaal jamie foxx peter sarsgaard scott macdonald
The Simpsons Movie,7.012,homer accidentally pollute town water supply springfield encase gigantic dome epa simpson declare fugitive animation comedy family david silverman dan castellaneta julie kavner nancy cartwright yeardley smith
Pirates of the Caribbean: Dead Man's Chest,7.364,captain jack sparrow work way blood debt ghostly davy jones avoid eternal damnation adventure fantasy action gore verbinski johnny depp orlando bloom keira knightley stellan skarsgård
War of the Worlds,6.512,ray ferrier divorced dockworker lessthanperfect father soon exwife new husband drop teenage son young daughter rare weekend visit strange powerful lightning storm touch adventure thriller science fiction steven spielberg tom cruise dakota fanning justin chatwin miranda otto
Indiana Jones and the Temple of Doom,7.298,arrive india indiana jones ask desperate village find mystical stone agree – stumble upon secret cult plot terrible plan catacomb ancient palace adventure action steven spielberg harrison ford kate capshaw ke huy quan amrish puri
Dirty Dancing,7.339,expect usual tedium accompany summer catskills family 17yearold france baby houseman surprise find step shoe professional hoofer—and unexpectedly fall love drama music romance emile ardolino jennifer grey patrick swayze jerry orbach cynthia rhodes
Beverly Hills Cop,7.198,fasttalking quickthinking detroit street cop axel foley bend rule regs time best friend murder head sunny beverly hill work case like comedy crime action martin brest eddie murphy judge reinhold john ashton lisa eilbacher
Beverly Hills Cop II,6.505,axel foley return land sunshine palm tree investigate nearfatal shooting police captain andrew bogomil help sgt taggart det rosewood soon uncover shooting associate series alphabet robbery mastermind heartless weapon kingpin—and chase action comedy crime tony scott eddie murphy judge reinhold john ashton jürgen prochnow
Pretty Woman,7.466,business trip los angeles edward lewis millionaire entrepreneur make living buying break company pick prostitute vivian ask direction edward hire vivian stay weekend accompany social event two get close discover significant hurdle overcome try bridge gap different world romance comedy garry marshall richard gere julia roberts jason alexander ralph bellamy
Charlie and the Chocolate Factory,7.052,young boy win tour magnificent chocolate factory world lead world unusual candy maker adventure comedy family fantasy tim burton johnny depp freddie highmore david kelly helena bonham carter
The Lord of the Rings,6.593,fellowship ring embark journey destroy one ring end sauron reign middleearth adventure animation fantasy ralph bakshi christopher guard william squire michael scholes john hurt
Star Trek: The Motion Picture,6.472,unidentified alien destroys three powerful klingon cruiser captain james kirk return newly transform youss enterprise take command science fiction adventure mystery robert wise william shatner leonard nimoy deforest kelley james doohan
Ocean's Twelve,6.568,danny ocean reunites old flame rest merry band thief carry three huge heist rome paris amsterdam – europol agent hot heel thriller crime steven soderbergh george clooney brad pitt matt damon catherine zeta-jones
Star Trek IV: The Voyage Home,7.137,huge alien probe enter galaxy begin vaporize earth ocean kirk crew must travel back time order bring back whale save planet science fiction adventure leonard nimoy william shatner leonard nimoy deforest kelley james doohan
Predator 2,6.28,police chief wartorn street los angeles discovers extraterrestrial creature hunt resident next target science fiction action thriller stephen hopkins danny glover gary busey rubén blades maría conchita alonso
28 Days Later,7.225,twentyeight day killer virus accidentally unleash british research facility small group london survivor catch desperate struggle protect infect carry animal human virus turn infect homicidal maniac absolutely impossible contain horror thriller science fiction danny boyle cillian murphy naomie harris brendan gleeson megan burns
Star Trek V: The Final Frontier,5.7,renegade vulcan startle secret hijack youss enterprise order find mythical planet science fiction action adventure thriller william shatner william shatner leonard nimoy deforest kelley james doohan
"20,000 Leagues Under the Sea",7.042,ship send investigate wave mysterious sinking encounter advanced submarine nautilus command captain nemo adventure science fiction family richard fleischer kirk douglas james mason paul lukas peter lorre
Star Trek VI: The Undiscovered Country,7.006,year war federation klingon empire find brink peace summit klingon ship nearly destroy apparent attack enterprise world brace may deadly encounter science fiction action adventure thriller nicholas meyer william shatner leonard nimoy deforest kelley james doohan
The Interpreter,6.307,silvia broome interpreter united nation headquarters overhears plan assassination american secret service agent send investigate crime thriller sydney pollack nicole kidman sean penn catherine keener jesper christensen
Sin City: A Dame to Kill For,6.381,sin city hardboiled citizen cross path reviled inhabitant crime action thriller frank miller jessica alba bruce willis mickey rourke josh brolin
The Name of the Rose,7.5,14thcentury franciscan monk william baskerville young novice arrive conference find several monk murder mysterious circumstance solve crime william must rise church authority fight shadowy conspiracy monastery monk use intelligence – considerable drama thriller mystery jean-jacques annaud sean connery f. murray abraham christian slater helmut qualtinger
Back to the Future Part III,7.478,final installment back future trilogy find marty dig trusty delorean mineshaft look doc wild west 1885 time machine break traveler strand land spur problem arise doc fall pretty schoolteacher clara clayton marty tangle buford tannen adventure comedy science fiction robert zemeckis michael j. fox christopher lloyd mary steenburgen thomas f. wilson
Star Trek: First Contact,7.293,borg relentless race cyborg direct course earth violate order stay away battle captain picard crew newlycommissioned uss enterprise e pursue borg back time prevent invader change federation history assimilate galaxy science fiction action adventure thriller jonathan frakes patrick stewart jonathan frakes brent spiner levar burton
Mean Streets,7.1,smalltime hood must choose among love friendship chance rise within mob drama crime martin scorsese harvey keitel robert de niro david proval richard romanus
Indiana Jones and the Kingdom of the Crystal Skull,6.011,set cold war soviets—led swordwielding irina spalko—are search crystal skull supernatural power relate mystical lose city gold indy coerce head peru behest young man whose friend—and indy colleague—professor oxley capture knowledge skull whereabouts adventure action steven spielberg harrison ford cate blanchett karen allen shia labeouf
The Outsiders,7.2,two poor greaser johnny ponyboy assault vicious gang socs johnny kill one attacker tension begin mount two rival gang set turbulent chain event crime drama francis ford coppola c. thomas howell matt dillon ralph macchio patrick swayze
The Godfather Part II,8.575,continue saga corleone crime family young vito corleone grow sicily 1910s new york 1950s michael corleone attempt expand family business la vega hollywood cuba drama crime francis ford coppola al pacino robert duvall diane keaton robert de niro
The Godfather Part III,7.4,midst try legitimize business dealing 1979 new york italy age mafia michael corleone seek forgiveness sin take young protege wing crime drama thriller francis ford coppola al pacino diane keaton talia shire andy garcía
Pirates of the Caribbean: At World's End,7.259,turner elizabeth swann join force revive captain barbossa free jack sparrow davy jones locker group must navigate dangerous water confront many foe ultimately choose side battle wherein piracy hang balance adventure fantasy action gore verbinski johnny depp orlando bloom keira knightley geoffrey rush
Terminator 3: Rise of the Machines,6.167,10 year since john connor save earth judgment day live radar steer clear use anything skynet trace encounter tx robotic assassin order finish t1000 start good thing connor former nemesis terminator back aid nowadult connor … like promise action thriller science fiction jonathan mostow arnold schwarzenegger nick stahl claire danes kristanna loken
Ocean's Thirteen,6.726,danny ocean team criminal back compose plan personal ever ruthless casino owner willy bank doublecrosses reuben tishkoff cause heart attack danny ocean vow team anything bring willy bank along everything get even mean ask help enemy crime thriller steven soderbergh george clooney brad pitt matt damon andy garcía
Beverly Hills Cop III,5.872,bos kill detroit cop axel foley find evidence murderer tie california amusement park call wonder world return sunny beverly hill foley reunites detective billy rosewood solve case along billy new partner detective jon flint discover wonder world use front massive counterfeiting ring action comedy crime john landis eddie murphy judge reinhold hector elizondo timothy carhart
Bruce Almighty,6.715,bruce nolan toil human interest television reporter buffalo ny despite high rating love beautiful girlfriend bruce remain unfulfilled end bad day life angrily ridicule god almighty respond endow bruce divine power fantasy comedy tom shadyac jim carrey morgan freeman jennifer aniston philip baker hall
Catwoman,4.599,liquidate discover corporate conspiracy mildmannered graphic artist patience phillips wash island resurrect endow prowess cat — eager use new skill vigilante say cat mouse handsome gumshoe tom lone tail fascinate persona action fantasy crime pitof halle berry benjamin bratt sharon stone lambert wilson
Eyes Wide Shut,7.485,dr bill harford wife alice admit sexual fantasy man meet bill becomes obsess sexual encounter discover underground sexual group attend one meeting quickly discovers head drama thriller mystery stanley kubrick tom cruise nicole kidman sydney pollack marie richardson
The Devil Wears Prada,7.395,andy move new york work fashion industry bos extremely demanding cruel let succeed fit high class elegant look magazine drama comedy david frankel meryl streep anne hathaway emily blunt stanley tucci
A Nightmare on Elm Street,7.341,teenager small town drop like fly apparently grip mass hysteria cause suicide cop daughter nancy thompson trace child molester fred krueger burn alive angry parent many year krueger come back dream killer child claim life revenge nancy boyfriend glen must devise plan lure monster realm nightmare real world horror wes craven heather langenkamp john saxon ronee blakley amanda wyss
Basic Instinct,6.918,catherine novelist insatiable sexual appetite become prime suspect boyfriend brutally murder crime describe late story thriller mystery paul verhoeven michael douglas sharon stone george dzundza jeanne tripplehorn
Snow White and the Seven Dwarfs,7.126,beautiful girl snow white take refuge forest house seven dwarf hide stepmother wicked queen queen jealous want know fair land snow white beauty surpass fantasy animation family david hand adriana caselotti lucille la verne harry stockwell roy atwell
The English Patient,7.2,1930s count almásy hungarian map maker employ royal geographical society chart vast expanse sahara desert along several prominent explorer world war ii unfolds almásy enters world love betrayal politics drama romance war anthony minghella ralph fiennes juliette binoche willem dafoe kristin scott thomas
"The Chronicles of Narnia: The Lion, the Witch and the Wardrobe",7.137,sibling lucy edmund susan peter step magical wardrobe find land narnia discover charming peaceful kingdom plunge eternal winter evil white witch jadis aid wise magnificent lion aslan child lead narnia spectacular climactic battle free witch glacial power forever adventure family fantasy andrew adamson georgie henley skandar keynes william moseley anna popplewell
Ice Age,7.361,impend ice age almost upon mismatched trio prehistoric critter – manny woolly mammoth diego sabertoothed tiger sid giant sloth – find orphan infant decide return human parent along way unlikely ally become friend enemy attack quest take far noble aim animation comedy family adventure chris wedge ray romano john leguizamo denis leary goran visnjic
The Day After Tomorrow,6.537,year increase greenhouse effect havoc wreak globally form catastrophic hurricane tornado tidal wave flood beginning new ice age paleoclimatologist jack hall try warn world also shepherd safety son trap new york city overwhelm start new big freeze action adventure science fiction thriller roland emmerich dennis quaid jake gyllenhaal emmy rossum dash mihok
Borat: Cultural Learnings of America for Make Benefit Glorious Nation of Kazakhstan,6.779,kazakh journalist borat sagdiyev travel america make documentary zigzag across nation borat meet real people real situation hysterical consequence backwards behavior generate strong reaction around expose prejudice hypocrisy american culture comedy larry charles sacha baron cohen ken davitian luenell pamela anderson
Love Actually,7.118,eight london couple try deal relationship different way tryst love make discover complicated relationship comedy romance drama richard curtis hugh grant alan rickman emma thompson liam neeson
Wallace & Gromit: The Curse of the Were-Rabbit,7.091,cheeseloving eccentric wallace cunning canine pal gromit investigate mystery nick park animated adventure lovable inventor intrepid pup run business rid town garden pest use humane method turn home halfway house evicted vermin pair stumble upon mystery involve voracious vegetarian monster threaten ruin annual veggiegrowing contest adventure animation comedy family steve box peter sallis ralph fiennes helena bonham carter peter kay
Flashdance,6.5,alex owen teen juggle two odd job aspire become successful ballet dancer nick bos lover support encourage fulfil dream drama romance adrian lyne jennifer beals michael nouri sunny johnson kyle t. heffner
There's Something About Mary,6.602,ted prom night go bad possible night go thirteen year later finally get another chance old prom date run suitor include sleazy detective hire find romance comedy peter farrelly cameron diaz matt dillon ben stiller lee evans
Constantine,7.093,john constantine literally hell back team policewoman solve mysterious suicide twin sister investigation take world demon angel exist beneath landscape contemporary los angeles fantasy action horror francis lawrence keanu reeves rachel weisz shia labeouf djimon hounsou
Starship Troopers,7.069,set future story follow young soldier name johnny rico exploit mobile infantry rico military career progress recruit noncommissioned officer finally officer backdrop interstellar war mankind arachnoid specie know bug adventure action thriller science fiction paul verhoeven casper van dien dina meyer denise richards jake busey
The Mummy,6.935,dash legionnaire rick oconnell stumble upon hidden ruin hamunaptra midst battle claim area 1920s egypt three thousand year since former high priest imhotep suffer fate bad death punishment forbidden love—along curse guarantee eternal doom upon world ever awake adventure action fantasy stephen sommers brendan fraser rachel weisz john hannah arnold vosloo
The Ring,6.7,rachel keller journalist investigate videotape may kill four teenager urban legend tape viewer die seven day watch rachel track video watch seven day unravel mystery ring save son horror mystery gore verbinski naomi watts martin henderson david dorfman brian cox
Jaws: The Revenge,4.1,another deadly shark attack ellen brody decide enough new england amity island move caribbean join son michael family great white shark follow hungry life adventure thriller horror joseph sargent lorraine gary lance guest mario van peebles michael caine
The Da Vinci Code,6.726,murder paris ’ louvre museum cryptic clue leonardo da vinci ’ famous painting lead discovery religious mystery 2000 year secret society closely guards information — come light — could rock foundation christianity thriller mystery ron howard tom hanks audrey tautou ian mckellen jean reno
The Terminal,7.343,viktor navorski man without country plane take coup detat explode homeland leave shamble strand kennedy airport hold passport nobody recognize quarantine transit lounge authority figure viktor simply go living – court romance beautiful flight attendant comedy drama steven spielberg tom hanks catherine zeta-jones stanley tucci chi mcbride
The Matrix Reloaded,7.054,six month event depict matrix neo prove good omen free human human free matrix bring zion one stronghold resistance neo discover superpower include super speed ability see code thing inside matrix certain degree precognition nasty piece news hit human resistance 250000 machine sentinel dig zion would reach 72 hour zion prepares ultimate war neo morpheus trinity advise oracle find keymaker would help reach source meanwhile neo recurrent dream depict trinity death get worried enough agent smith somehow escape deletion become powerful fix neo next target adventure action thriller science fiction lilly wachowski keanu reeves laurence fishburne carrie-anne moss hugo weaving
The Matrix Revolutions,6.728,human city zion defend massive invasion machine neo fight end war another front also oppose rogue agent smith adventure action thriller science fiction lana wachowski keanu reeves laurence fishburne carrie-anne moss hugo weaving
The Passion of the Christ,7.502,graphic portrayal last twelve hour jesus nazareth life drama mel gibson jim caviezel maia morgenstern christo jivkov francesco de vito
Wild Things,6.363,teensocialite kelly van ryan troubled bad girl suzie toller accuse guidance counselor sam lombardo rape suspend school reject town fight get life back one cop suspect conspiracy nothing seem mystery thriller drama john mcnaughton kevin bacon matt dillon neve campbell denise richards
The Bodyguard,6.692,former secret service agent grudgingly take assignment protect pop idol threaten crazed fan first safetyobsessed bodyguard selfindulgent diva totally clash long tension spark firework another sort loveaverse tough guy tear duty romance action drama romance mick jackson kevin costner whitney houston gary kemp bill cobbs
Grease,7.393,australian good girl sandy greaser danny fell love summer unexpectedly discover high school able rekindle romance despite eccentric friend romance comedy randal kleiser john travolta olivia newton-john stockard channing jeff conaway
The Ninth Gate,6.469,allexpensespaid international search rare copy book nine gate kingdom shadow brings unscrupulous book dealer deep world murder doubledealing satanic worship mystery thriller horror roman polanski johnny depp frank langella lena olin emmanuelle seigner
A Fish Called Wanda,7.2,diamond advocate attempt steal collection diamond trouble arise realise one collection comedy crime charles crichton jamie lee curtis john cleese kevin kline michael palin
Interview with the Vampire,7.388,vampire relate epic life story love betrayal loneliness dark hunger overcurious reporter horror drama fantasy neil jordan tom cruise brad pitt antonio banderas christian slater
